Literacy,Reading and viewing,Understanding texts,Level 7,,Comprehension,LP9-RV-UT-Level7-04,4,"identifies the purpose of a broad range of informative, imaginative and persuasive texts (e.g. advertisements, diary entry)","identifies the purpose of a broad range of informative, imaginative and persuasive texts","e.g. advertisements, diary entry",,,,,Yes,Yes,,,,,
Literacy,Reading and viewing,Understanding texts,Level 7,,Comprehension,LP9-RV-UT-Level7-05,5,draws inferences and identifies supporting evidence in the text,draws inferences and identifies supporting evidence in the text,,,,,,Yes,Yes,,,,,
Literacy,Reading and viewing,Understanding texts,Level 7,,Comprehension,LP9-RV-UT-Level7-06,6,"monitors the development of ideas using language and visual features (e.g. topic sentences, key verbs, graphs)",monitors the development of ideas using language and visual features,"e.g. topic sentences, key verbs, graphs",,,,,Yes,Yes,,,,,
Literacy,Reading and viewing,Understanding texts,Level 7,,Comprehension,LP9-RV-UT-Level7-07,7,recognises that texts can present different points of view,recognises that texts can present different points of view,,,,,,Yes,Yes,,,,,
Literacy,Reading and viewing,Understanding texts,Level 7,,Comprehension,LP9-RV-UT-Level7-08,8,distinguishes between fact and opinion in texts,distinguishes between fact and opinion in texts,,,,,,Yes,Yes,,,,,
Literacy,Reading and viewing,Understanding texts,Level 7,,Comprehension,LP9-RV-UT-Level7-09,9,compares and contrasts texts on the same topic to identify how authors represent the same ideas differently,compares and contrasts texts on the same topic to identify how authors represent the same ideas differently,,,,,,Yes,Yes,,,,,
Literacy,Reading and viewing,Understanding texts,Level 7,,Processes,LP9-RV-UT-Level7-10,10,"integrates phonic knowledge, word recognition skills, grammatical and contextual knowledge to read elementary texts (see Phonic knowledge and word recognition and Fluency)","integrates phonic knowledge, word recognition skills, grammatical and contextual knowledge to read elementary texts (see Phonic knowledge and word recognition and Fluency)",,,,,,Yes,Yes,,,,,
Literacy,Reading and viewing,Understanding texts,Level 7,,Processes,LP9-RV-UT-Level7-11,11,"identifies language features that signal purpose in an elementary text (e.g. diagrams, dialogue)",identifies language features that signal purpose in an elementary text,"e.g. diagrams, dialogue",,,,,Yes,Yes,,,,,
Literacy,Reading and viewing,Understanding texts,Level 7,,Processes,LP9-RV-UT-Level7-12,12,uses strategies to predict and confirm meaning (e.g. uses sentence structure to predict how ideas will be developed),uses strategies to predict and confirm meaning,e.g. uses sentence structure to predict how ideas will be developed,,,,,Yes,Yes,,,,,
Literacy,Reading and viewing,Understanding texts,Level 7,,Processes,LP9-RV-UT-Level7-13,13,"navigates texts using common signposting devices such as headings, subheadings, paragraphs, navigation bars and links","navigates texts using common signposting devices such as headings, subheadings, paragraphs, navigation bars and links",,,,,,Yes,Yes,,,,,
Literacy,Reading and viewing,Understanding texts,Level 7,,Vocabulary,LP9-RV-UT-Level7-14,14,"interprets creative use of figurative language (e.g. metaphor, simile, onomatopoeia)",interprets creative use of figurative language,"e.g. metaphor, simile, onomatopoeia",,,,,Yes,Yes,,,,,
Literacy,Reading and viewing,Understanding texts,Level 7,,Vocabulary,LP9-RV-UT-Level7-15,15,"interprets unfamiliar words using grammatical knowledge, morphological knowledge and etymological knowledge","interprets unfamiliar words using grammatical knowledge, morphological knowledge and etymological knowledge",,,,,,Yes,Yes,,,,,
Literacy,Reading and viewing,Understanding texts,Level 7,,Vocabulary,LP9-RV-UT-Level7-16,16,"describes the language and visual features of texts using metalanguage (e.g. grammatical terms such as ""cohesion"", ""tense"", ""noun groups/phrases"")",describes the language and visual features of texts using metalanguage,"e.g. grammatical terms such as ""cohesion"", ""tense"", ""noun groups/phrases""",,,,,Yes,Yes,,,,,
Literacy,Reading and viewing,Understanding texts,Level 7,,Vocabulary,LP9-RV-UT-Level7-17,17,"recognises how synonyms are used to enhance a text (e.g. ""transport"", ""carry"", ""transfer"")",recognises how synonyms are used to enhance a text,"e.g. ""transport"", ""carry"", ""transfer""",,,,,Yes,Yes,,,,,
Literacy,Reading and viewing,Understanding texts,Level 7,,Vocabulary,LP9-RV-UT-Level7-18,18,"draws on knowledge of word origin to work out meaning of discipline-specific terms (e.g. ""universe"")",draws on knowledge of word origin to work out meaning of discipline-specific terms,"e.g. ""universe""",,,,,Yes,Yes,,,,,
Literacy,Reading and viewing,Understanding texts,Level 7,,Vocabulary,LP9-RV-UT-Level7-19,19,"recognises how evaluative and modal words are used to influence the reader (e.g. ""important"", ""should"", ""dirty"")",recognises how evaluative and modal words are used to influence the reader,"e.g. ""important"", ""should"", ""dirty""",,,,,Yes,Yes,,,,,
Literacy,Reading and viewing,Understanding texts,Level 8,,Comprehension,LP9-RV-UT-Level8-01,1,reads and views some moderately complex texts (see Text complexity),reads and views some moderately complex texts (see Text complexity),,,,,,,Yes,Yes,,,,
Literacy,Reading and viewing,Understanding texts,Level 8,,Comprehension,LP9-RV-UT-Level8-02,2,accurately retells a text including most relevant details,accurately retells a text including most relevant details,,,,,,,Yes,Yes,,,,
Literacy,Reading and viewing,Understanding texts,Level 8,,Comprehension,LP9-RV-UT-Level8-03,3,identifies main idea and related or supporting ideas in moderately complex texts (see Text complexity),identifies main idea and related or supporting ideas in moderately complex texts (see Text complexity),,,,,,,Yes,Yes,,,,
Literacy,Reading and viewing,Understanding texts,Level 8,,Comprehension,LP9-RV-UT-Level8-04,4,evaluates the accuracy within and across texts on the same topic,evaluates the accuracy within and across texts on the same topic,,,,,,,Yes,Yes,,,,
Literacy,Reading and viewing,Understanding texts,Level 8,,Comprehension,LP9-RV-UT-Level8-05,5,explains how authors use evidence and supporting detail to build and verify ideas,explains how authors use evidence and supporting detail to build and verify ideas,,,,,,,Yes,Yes,,,,
Literacy,Reading and viewing,Understanding texts,Level 8,,Comprehension,LP9-RV-UT-Level8-06,6,draws inferences and verifies using textual evidence,draws inferences and verifies using textual evidence,,,,,,,Yes,Yes,,,,
Literacy,Reading and viewing,Understanding texts,Level 8,,Processes,LP9-RV-UT-Level8-07,7,monitors reading for meaning using grammatical and contextual knowledge (see Fluency),monitors reading for meaning using grammatical and contextual knowledge (see Fluency),,,,,,,Yes,Yes,,,,
Literacy,Reading and viewing,Understanding texts,Level 8,,Processes,LP9-RV-UT-Level8-08,8,explains how textual features support the text’s purpose,explains how textual features support the text’s purpose,,,,,,,Yes,Yes,,,,
Literacy,Reading and viewing,Understanding texts,Level 8,,Processes,LP9-RV-UT-Level8-09,9,"identifies and explains techniques used to present perspective (e.g. emotive or descriptive language, order in which ideas are presented)",identifies and explains techniques used to present perspective,"e.g. emotive or descriptive language, order in which ideas are presented",,,,,,Yes,Yes,,,,
Literacy,Reading and viewing,Understanding texts,Level 8,,Processes,LP9-RV-UT-Level8-10,10,"predicts the development of ideas based on a partial read (e.g. predicts the final chapter of a narrative, drawing on understanding of the textual features in the previous chapters)",predicts the development of ideas based on a partial read,"e.g. predicts the final chapter of a narrative, drawing on understanding of the textual features in the previous chapters",,,,,,Yes,Yes,,,,
Literacy,Reading and viewing,Understanding texts,Level 8,,Processes,LP9-RV-UT-Level8-11,11,"uses prior knowledge and context to read unknown words (e.g. uses morphemic knowledge of ""explosion"" to decode ""explosive"" and uses context and knowledge of metaphorical use of language to understand ""explosive outburst"")",uses prior knowledge and context to read unknown words,"e.g. uses morphemic knowledge of ""explosion"" to decode ""explosive"" and uses context and knowledge of metaphorical use of language to understand ""explosive outburst""",,,,,,Yes,Yes,,,,
Literacy,Reading and viewing,Understanding texts,Level 8,,Processes,LP9-RV-UT-Level8-12,12,"uses knowledge of cohesive devices to track meaning throughout a text (e.g. connectives such as ""however"", ""on the other hand"") (see Grammar)","uses knowledge of cohesive devices to track meaning throughout a text (e.g. connectives such as ""however"", ""on the other hand"") (see Grammar)",,,,,,,Yes,Yes,,,,
Literacy,Reading and viewing,Understanding texts,Level 8,,Processes,LP9-RV-UT-Level8-13,13,uses knowledge of the features and conventions of the type of text to build meaning (e.g. recognises that the beginning of a persuasive text may introduce the topic and the line of argument),uses knowledge of the features and conventions of the type of text to build meaning,e.g. recognises that the beginning of a persuasive text may introduce the topic and the line of argument,,,,,,Yes,Yes,,,,
Literacy,Reading and viewing,Understanding texts,Level 8,,Processes,LP9-RV-UT-Level8-14,14,identifies language features used to present opinions or points of view,identifies language features used to present opinions or points of view,,,,,,,Yes,Yes,,,,
Literacy,Reading and viewing,Understanding texts,Level 8,,Processes,LP9-RV-UT-Level8-15,15,skims and scans texts for key words to track the development of ideas,skims and scans texts for key words to track the development of ideas,,,,,,,Yes,Yes,,,,
Literacy,Reading and viewing,Understanding texts,Level 8,,Processes,LP9-RV-UT-Level8-16,16,uses sophisticated punctuation to support meaning (e.g. commas to separate clauses in complex sentences),uses sophisticated punctuation to support meaning,e.g. commas to separate clauses in complex sentences,,,,,,Yes,Yes,,,,
Literacy,Reading and viewing,Understanding texts,Level 8,,Vocabulary,LP9-RV-UT-Level8-17,17,uses knowledge of prefixes and suffixes to read and interpret unfamiliar words,uses knowledge of prefixes and suffixes to read and interpret unfamiliar words,,,,,,,Yes,Yes,,,,
Literacy,Reading and viewing,Understanding texts,Level 8,,Vocabulary,LP9-RV-UT-Level8-18,18,identifies how technical and discipline-specific words develop meaning in texts,identifies how technical and discipline-specific words develop meaning in texts,,,,,,,Yes,Yes,,,,
Literacy,Reading and viewing,Understanding texts,Level 8,,Vocabulary,LP9-RV-UT-Level8-19,19,"analyses the effect of antonyms, synonyms and idiomatic language","analyses the effect of antonyms, synonyms and idiomatic language",,,,,,,Yes,Yes,,,,
Literacy,Reading and viewing,Understanding texts,Level 8,,Vocabulary,LP9-RV-UT-Level8-20,20,"understands precise meaning of words with similar connotations (e.g. ""generous"", ""kind-hearted"", ""charitable"")",understands precise meaning of words with similar connotations,"e.g. ""generous"", ""kind-hearted"", ""charitable""",,,,,,Yes,Yes,,,,
Literacy,Reading and viewing,Understanding texts,Level 9,,Comprehension,LP9-RV-UT-Level9-01,1,reads and views complex texts (see Text complexity),reads and views complex texts (see Text complexity),,,,,,,,Yes,Yes,,,
Literacy,Reading and viewing,Understanding texts,Level 9,,Comprehension,LP9-RV-UT-Level9-02,2,identifies the main themes or concepts in complex texts by synthesising key ideas or information,identifies the main themes or concepts in complex texts by synthesising key ideas or information,,,,,,,,Yes,Yes,,,
Literacy,Reading and viewing,Understanding texts,Level 9,,Comprehension,LP9-RV-UT-Level9-03,3,"summarises the text, identifying key details only","summarises the text, identifying key details only",,,,,,,,Yes,Yes,,,
Literacy,Reading and viewing,Understanding texts,Level 9,,Comprehension,LP9-RV-UT-Level9-04,4,"draws inferences, synthesising clues and evidence across a text","draws inferences, synthesising clues and evidence across a text",,,,,,,,Yes,Yes,,,
Literacy,Reading and viewing,Understanding texts,Level 9,,Comprehension,LP9-RV-UT-Level9-05,5,builds meaning by actively linking ideas from a number of texts or a range of digital sources,builds meaning by actively linking ideas from a number of texts or a range of digital sources,,,,,,,,Yes,Yes,,,
Literacy,Reading and viewing,Understanding texts,Level 9,,Comprehension,LP9-RV-UT-Level9-06,6,distils information from a number of texts according to task and purpose (e.g. uses graphic organisers),distils information from a number of texts according to task and purpose,e.g. uses graphic organisers,,,,,,,Yes,Yes,,,
Literacy,Reading and viewing,Understanding texts,Level 9,,Comprehension,LP9-RV-UT-Level9-07,7,identifies different interpretations of the text citing evidence from a text,identifies different interpretations of the text citing evidence from a text,,,,,,,,Yes,Yes,,,
Literacy,Reading and viewing,Understanding texts,Level 9,,Comprehension,LP9-RV-UT-Level9-08,8,evaluates language features for relevance to purpose and audience,evaluates language features for relevance to purpose and audience,,,,,,,,Yes,Yes,,,
Literacy,Reading and viewing,Understanding texts,Level 9,,Comprehension,LP9-RV-UT-Level9-09,9,analyses texts that have more than one purpose and explains how parts of the text support a particular purpose,analyses texts that have more than one purpose and explains how parts of the text support a particular purpose,,,,,,,,Yes,Yes,,,
Literacy,Reading and viewing,Understanding texts,Level 9,,Comprehension,LP9-RV-UT-Level9-10,10,analyses the use of language appropriate to different types of texts (e.g. compare the use of pun in imaginative and persuasive texts),analyses the use of language appropriate to different types of texts,e.g. compare the use of pun in imaginative and persuasive texts,,,,,,,Yes,Yes,,,
Literacy,Reading and viewing,Understanding texts,Level 9,,Comprehension,LP9-RV-UT-Level9-11,11,identifies techniques used to obscure author’s purpose (e.g. inclusion or omission of content),identifies techniques used to obscure author’s purpose,e.g. inclusion or omission of content,,,,,,,Yes,Yes,,,
Literacy,Reading and viewing,Understanding texts,Level 9,,Processes,LP9-RV-UT-Level9-12,12,"uses processes such as predicting, confirming predictions, monitoring, and connecting relevant elements of the text to build or repair meaning","uses processes such as predicting, confirming predictions, monitoring, and connecting relevant elements of the text to build or repair meaning",,,,,,,,Yes,Yes,,,
Literacy,Reading and viewing,Understanding texts,Level 9,,Processes,LP9-RV-UT-Level9-13,13,uses knowledge of a broader range of cohesive devices to track meaning (e.g. word associations) (see Grammar),uses knowledge of a broader range of cohesive devices to track meaning (e.g. word associations) (see Grammar),,,,,,,,Yes,Yes,,,
Literacy,Reading and viewing,Understanding texts,Level 9,,Processes,LP9-RV-UT-Level9-14,14,selects reading or viewing strategies appropriate to reading purpose (e.g. scans text for evidence),selects reading or viewing strategies appropriate to reading purpose,e.g. scans text for evidence,,,,,,,Yes,Yes,,,
Literacy,Reading and viewing,Understanding texts,Level 9,,Processes,LP9-RV-UT-Level9-15,15,judiciously selects texts for learning area tasks and purposes,judiciously selects texts for learning area tasks and purposes,,,,,,,,Yes,Yes,,,
Literacy,Reading and viewing,Understanding texts,Level 9,,Vocabulary,LP9-RV-UT-Level9-16,16,identifies language used to create tone or atmosphere,identifies language used to create tone or atmosphere,,,,,,,,Yes,Yes,,,
Literacy,Reading and viewing,Understanding texts,Level 9,,Vocabulary,LP9-RV-UT-Level9-17,17,"analyses language and visual features in texts using metalanguage (e.g. cohesion, interpretation, figurative)",analyses language and visual features in texts using metalanguage,"e.g. cohesion, interpretation, figurative",,,,,,,Yes,Yes,,,
Literacy,Reading and viewing,Understanding texts,Level 9,,Vocabulary,LP9-RV-UT-Level9-18,18,"applies knowledge of base words and word origins to understand the meaning of unfamiliar, discipline-specific words","applies knowledge of base words and word origins to understand the meaning of unfamiliar, discipline-specific words",,,,,,,,Yes,Yes,,,
Literacy,Reading and viewing,Understanding texts,Level 9,,Vocabulary,LP9-RV-UT-Level9-19,19,uses a range of context and grammatical cues to understand unfamiliar words,uses a range of context and grammatical cues to understand unfamiliar words,,,,,,,,Yes,Yes,,,
Literacy,Reading and viewing,Understanding texts,Level 9,,Vocabulary,LP9-RV-UT-Level9-20,20,"interprets complex figurative language (e.g. euphemisms, hyperbole)",interprets complex figurative language,"e.g. euphemisms, hyperbole",,,,,,,Yes,Yes,,,
Literacy,Reading and viewing,Understanding texts,Level 10,,Comprehension,LP9-RV-UT-Level10-01,1,reads and views complex or some highly complex texts (see Text complexity),reads and views complex or some highly complex texts (see Text complexity),,,,,,,,,,Yes,Yes,
Literacy,Reading and viewing,Understanding texts,Level 10,,Comprehension,LP9-RV-UT-Level10-02,2,interprets abstract concepts integrating complex ideas,interprets abstract concepts integrating complex ideas,,,,,,,,,,Yes,Yes,
Literacy,Reading and viewing,Understanding texts,Level 10,,Comprehension,LP9-RV-UT-Level10-03,3,analyses how language features are used to support the point of view in a text (e.g. the strategic use of images such as a cartoon in an editorial),analyses how language features are used to support the point of view in a text,e.g. the strategic use of images such as a cartoon in an editorial,,,,,,,,,Yes,Yes,
Literacy,Reading and viewing,Understanding texts,Level 10,,Comprehension,LP9-RV-UT-Level10-04,4,draws inferences using evidence from the text and discounting possible inferences that are not supported by the text,draws inferences using evidence from the text and discounting possible inferences that are not supported by the text,,,,,,,,,,Yes,Yes,
Literacy,Reading and viewing,Understanding texts,Level 10,,Comprehension,LP9-RV-UT-Level10-05,5,applies and articulates criteria to evaluate the language structures and features for relevance to purpose and audience,applies and articulates criteria to evaluate the language structures and features for relevance to purpose and audience,,,,,,,,,,Yes,Yes,
Literacy,Reading and viewing,Understanding texts,Level 10,,Comprehension,LP9-RV-UT-Level10-06,6,evaluates the reasoning and evidence in a persuasive text,evaluates the reasoning and evidence in a persuasive text,,,,,,,,,,Yes,Yes,
Literacy,Reading and viewing,Understanding texts,Level 10,,Comprehension,LP9-RV-UT-Level10-07,7,"explains how context (e.g. time, place, situation) influences interpretations of a text","explains how context (e.g. time, place, situation) influences interpretations of a text",,,,,,,,,,Yes,Yes,
Literacy,Reading and viewing,Understanding texts,Level 10,,Comprehension,LP9-RV-UT-Level10-08,8,analyses the author’s perspectives in complex or some highly complex texts,analyses the author’s perspectives in complex or some highly complex texts,,,,,,,,,,Yes,Yes,
Literacy,Reading and viewing,Understanding texts,Level 10,,Comprehension,LP9-RV-UT-Level10-09,9,analyses the techniques authors use to position readers,analyses the techniques authors use to position readers,,,,,,,,,,Yes,Yes,
Literacy,Reading and viewing,Understanding texts,Level 10,,Comprehension,LP9-RV-UT-Level10-10,10,recognises when ideas or evidence have been omitted from a text to position the reader,recognises when ideas or evidence have been omitted from a text to position the reader,,,,,,,,,,Yes,Yes,
Literacy,Reading and viewing,Understanding texts,Level 10,,Processes,LP9-RV-UT-Level10-11,11,"automatically integrates a range of processes such as predicting, confirming predictions, monitoring and connecting relevant elements of the text, to build meaning","automatically integrates a range of processes such as predicting, confirming predictions, monitoring and connecting relevant elements of the text, to build meaning",,,,,,,,,,Yes,Yes,
Literacy,Reading and viewing,Understanding texts,Level 10,,Processes,LP9-RV-UT-Level10-12,12,"describes how sophisticated cohesive devices establish patterns of meaning (e.g. ""class"" – ""subclass"")",describes how sophisticated cohesive devices establish patterns of meaning,"e.g. ""class"" – ""subclass""",,,,,,,,,Yes,Yes,
Literacy,Reading and viewing,Understanding texts,Level 10,,Processes,LP9-RV-UT-Level10-13,13,navigates extended texts including complex digital texts,navigates extended texts including complex digital texts,,,,,,,,,,Yes,Yes,
Literacy,Reading and viewing,Understanding texts,Level 10,,Vocabulary,LP9-RV-UT-Level10-14,14,"demonstrates an understanding of nuances and subtleties in words of similar meaning (e.g. ""frustrated"", ""discouraged"", ""baffled"")",demonstrates an understanding of nuances and subtleties in words of similar meaning,"e.g. ""frustrated"", ""discouraged"", ""baffled""",,,,,,,,,Yes,Yes,
Literacy,Reading and viewing,Understanding texts,Level 10,,Vocabulary,LP9-RV-UT-Level10-15,15,verifies interpretations of unfamiliar words using grammatical and contextual cues,verifies interpretations of unfamiliar words using grammatical and contextual cues,,,,,,,,,,Yes,Yes,
Literacy,Reading and viewing,Understanding texts,Level 11,,Comprehension,LP9-RV-UT-Level11-01,1,reads and views highly complex texts (see Text complexity),reads and views highly complex texts (see Text complexity),,,,,,,,,,,Yes,Yes
Literacy,Reading and viewing,Understanding texts,Level 11,,Comprehension,LP9-RV-UT-Level11-02,2,"interprets symbolism in texts, providing evidence to justify interpretation","interprets symbolism in texts, providing evidence to justify interpretation",,,,,,,,,,,Yes,Yes
Literacy,Reading and viewing,Understanding texts,Level 11,,Comprehension,LP9-RV-UT-Level11-03,3,judiciously selects and synthesises evidence from multiple texts to support ideas and arguments,judiciously selects and synthesises evidence from multiple texts to support ideas and arguments,,,,,,,,,,,Yes,Yes
Literacy,Reading and viewing,Understanding texts,Level 11,,Comprehension,LP9-RV-UT-Level11-04,4,analyses the credibility and validity of primary and secondary sources,analyses the credibility and validity of primary and secondary sources,,,,,,,,,,,Yes,Yes
Literacy,Reading and viewing,Understanding texts,Level 11,,Comprehension,LP9-RV-UT-Level11-05,5,"evaluates the use of devices such as analogy, irony, rhetoric and satire, and how they contribute to an author’s individual style","evaluates the use of devices such as analogy, irony, rhetoric and satire, and how they contribute to an author’s individual style",,,,,,,,,,,Yes,Yes
Literacy,Reading and viewing,Understanding texts,Level 11,,Comprehension,LP9-RV-UT-Level11-06,6,analyses the cumulative impact of use of language features and vocabulary across texts,analyses the cumulative impact of use of language features and vocabulary across texts,,,,,,,,,,,Yes,Yes
Literacy,Reading and viewing,Understanding texts,Level 11,,Comprehension,LP9-RV-UT-Level11-07,7,"explains assumptions, beliefs and implicit values in texts (e.g. ""economic growth is always desirable"")","explains assumptions, beliefs and implicit values in texts","e.g. ""economic growth is always desirable""",,,,,,,,,,Yes,Yes
Literacy,Reading and viewing,Understanding texts,Level 11,,Comprehension,LP9-RV-UT-Level11-08,8,"evaluates the social, moral and ethical positions taken in texts","evaluates the social, moral and ethical positions taken in texts",,,,,,,,,,,Yes,Yes
Literacy,Reading and viewing,Understanding texts,Level 11,,Processes,LP9-RV-UT-Level11-09,9,strategically adjusts the processes of reading and viewing to build meaning according to the demands of tasks and texts,strategically adjusts the processes of reading and viewing to build meaning according to the demands of tasks and texts,,,,,,,,,,,Yes,Yes
Literacy,Reading and viewing,Understanding texts,Level 11,,Processes,LP9-RV-UT-Level11-10,10,identifies subtle contradictions and inconsistencies in texts,identifies subtle contradictions and inconsistencies in texts,,,,,,,,,,,Yes,Yes
Literacy,Reading and viewing,Understanding texts,Level 11,,Vocabulary,LP9-RV-UT-Level11-11,11,"interprets complex, formal and impersonal language in academic texts","interprets complex, formal and impersonal language in academic texts",,,,,,,,,,,Yes,Yes
Literacy,Reading and viewing,Understanding texts,Level 11,,Vocabulary,LP9-RV-UT-Level11-12,12,uses lexical cues to interpret unfamiliar vocabulary,uses lexical cues to interpret unfamiliar vocabulary,,,,,,,,,,,Yes,Yes
